<?xml version="1.0" encoding="UTF-8"?>
<!DOCTYPE template PUBLIC "-//SEASAR//DTD S2JFace 0.1//EN" 
	"http://www.seasar.org/dtd/s2jface01.dtd">
<template name="scaleRendererTest" extends="RendererTest.xml">
  <extends id="scaleRendererTest" property="title">
    ScaleRendererTest
  </extends>
  <extends id="contents" />
  <window id="scaleRendererTest" layout="grid">

    <composite id="contents" type="box">
      <layoutData name="horizontalAlignment">FILL</layoutData>

      <control type="scale">
        <property name="max">100</property>
        <property name="min">0</property>
        <property name="selection">10</property>
        <property name="incriment">5</property>
      </control>

      <control type="scale">
        <property name="max">100</property>
        <property name="min">0</property>
        <property name="incriment">1</property>
        <property name="style">VARTICAL</property>
      </control>
    </composite>

  </window>
</template>
