<?xml version="1.0" encoding="UTF-8"?>
<!DOCTYPE template PUBLIC "-//SEASAR//DTD S2JFace 0.1//EN" 
	"http://www.seasar.org/dtd/s2jface01.dtd">
<template name="buttonRendererTest">
  <window id="buttonRendererTest" title="ButtonRendererTest" x="center"
    y="middle" minButton="false" maxButton="false" closeButton="false"
    resizable="false" layout="grid" layoutParam="numColumns=1">
    <property name="defaultButton">okButton</property>

    <composite type="box" layout="row"
      layoutParam="type=HORIZONTAL; marginHeight=10; marginWidth=10; spacing=10">
      <property name="fontSize">20</property>
      <layoutData name="horizontalAlignment">FILL</layoutData>

      <composite type="box" layout="row"
        layoutParam="type=VERTICAL; spacing=10">
        <!-- styleを省略した場合、style="PUSH" となります -->
        <control type="button">
          <property name="text">プッシュボタン</property>
          <property name="toolTip">ツールチップテキスト</property>
        </control>

        <control type="button" style="FLAT">
          <property name="text">フラットボタン</property>
        </control>

        <control type="button" style="RADIO">
          <property name="text">ラジオボタン</property>
        </control>

        <control type="button" style="CHECK">
          <property name="text">チェックボタン(OFF)</property>
        </control>

        <control type="button" style="CHECK">
          <property name="text">チェックボタン(ON)</property>
          <property name="selection">true</property>
        </control>

        <control type="button" style="TOGGLE">
          <property name="text">トグルボタン(OFF)</property>
        </control>

        <control type="button" style="TOGGLE">
          <property name="text">トグルボタン(ON)</property>
          <property name="selection">true</property>
        </control>

        <control type="button">
          <property name="text">フォントを変更</property>
          <property name="font">ＭＳ 明朝</property>
          <property name="fontSize">15</property>
          <property name="fontStyle">BOLD, ITALIC</property>
        </control>
      </composite>

      <composite type="box" layout="row"
        layoutParam="type=VERTICAL; spacing=10">
        <property name="width">30</property>
        <property name="height">30</property>

        <control type="button" style="ARROW, UP" />

        <control type="button" style="ARROW, RIGHT" />

        <control type="button" style="ARROW, DOWN" />

        <control type="button" style="ARROW, LEFT" />
      </composite>
    </composite>

    <control type="label" style="SEPARATOR, HORIZONTAL">
      <layoutData name="horizontalAlignment">FILL</layoutData>
    </control>

    <composite type="box" layout="fill"
      layoutParam="type=HORIZONTAL; spacing=5">
      <layoutData name="horizontalAlignment">FILL</layoutData>
      <control type="button" id="okButton">
        <property name="text">OK</property>
      </control>
      <control type="button" id="ngButton">
        <property name="text">NG</property>
      </control>
    </composite>

  </window>
</template>
