<?xml version="1.0" encoding="UTF-8"?>
<!DOCTYPE template PUBLIC "-//SEASAR//DTD S2JFace 0.1//EN"
	"http://www.seasar.org/dtd/s2jface01.dtd">
<template name="testTemplate" extends="templateBuilderTest.xml">
  <extends id="testButton" replace="true"/>

  <window id="templateBuilderTest6" layout="fill">
    <control id="testButton" type="button">
      <property name="x">30</property>
      <property name="y">40</property>
      <property name="width">100</property>
      <property name="height">200</property>
      <property name="text">override</property>
    </control>
  </window>
</template>
