<?xml version="1.0" encoding="UTF-8"?>
<!DOCTYPE template PUBLIC "-//SEASAR//DTD S2JFace 0.1//EN" 
	"http://www.seasar.org/dtd/s2jface01.dtd">
<template name="rendererTest">
  <window id="rendererTest" style="TITLE" layout="grid"
    layoutParam="numColumns=1">
    <property name="title">RendererTest</property>
    <property name="defaultButton">okButton</property>

    <composite id="contents" type="box" layout="row"
      layoutParam="type=HORIZONTAL; margin=10; spacing=10">
      <property name="fontSize">20</property>
      <layoutData name="horizontalAlignment">FILL</layoutData>
    </composite>

    <control type="label" style="SEPARATOR, HORIZONTAL">
      <layoutData name="horizontalAlignment">FILL</layoutData>
    </control>

    <composite type="box" layout="fill"
      layoutParam="type=HORIZONTAL; spacing=5">
      <layoutData name="horizontalAlignment">FILL</layoutData>
      <control type="button" id="okButton">
        <property name="text">OK</property>
      </control>
      <control type="button" id="ngButton">
        <property name="text">NG</property>
      </control>
    </composite>

  </window>
</template>
